{
  "schema": 1,
  "id": "strike-alley",
  "title": { "ja": "ストライク横丁", "en": "Strike Yokocho" },
  "summary": { "ja": "スマホに指をおいて、引いて、はなして投げる。路地裏のレーンで10本を倒そう。", "en": "Touch, pull back and let go to bowl. Topple all ten pins in a back-alley lane." },
  "authors": [{ "name": "irori contributors", "url": "https://github.com/haranishi/irori" }],
  "license": { "code": "MIT OR Apache-2.0", "assets": "original" },
  "players": { "min": 1, "max": 6 },
  "pads": ["wait", "touch", "choices"],
  "entry": { "bundled": "games/strike-alley/" },
  "thumbnail": "strike-alley.jpg",
  "sdk": 1,
  "rating": "all",
  "added": "2026-10-27"
}
